{
  "id": "9e9fe62c-cf4f-580f-b9d3-1637cc4c69c6",
  "name": "Открытый бой",
  "decayCurve": 0.4,
  "enabled": true,
  "axisWeights": {
    "spd": 2.0,
    "aoe": 2.0,
    "acc": 1.5,
    "stam": 1.3,
    "dur": 1.5,
    "ment": 0.6,
    "sens": 0.5,
    "heal": 0.5,
    "intel": 0.5,
    "range": 2.0
  }
}