{
  "id": "d5b6920e-9cf0-5165-bb91-ef37b64c3c5a",
  "name": "Осада",
  "decayCurve": 0.4,
  "enabled": true,
  "axisWeights": {
    "stam": 2.0,
    "ctrl": 2.0,
    "supp": 2.0,
    "heal": 2.0,
    "str": 0.7,
    "spd": 0.7,
    "acc": 0.1,
    "dur": 2.0,
    "sens": 0.2,
    "intel": 1.5,
    "range": 0.4,
    "aoe": 0.4
  }
}