{
  "id": "0d92effb-fb98-5aa2-a962-f6c60f818a81",
  "name": "Война",
  "decayCurve": 0.4,
  "enabled": true,
  "axisWeights": {
    "ctrl": 2.0,
    "ment": 2.0,
    "sens": 2.0,
    "str": 0.4,
    "spd": 1.4,
    "acc": 0.4,
    "stam": 1.2,
    "heal": 1.3,
    "supp": 1.2,
    "intel": 1.5,
    "range": 0.6,
    "aoe": 0.6,
    "dur": 0.6
  }
}