{
  "id": "e34c83a3-c42d-528d-a9dd-8b0beced0286",
  "name": "Разведка",
  "decayCurve": 0.4,
  "enabled": true,
  "axisWeights": {
    "str": 0.4,
    "spd": 1.4,
    "acc": 0.3,
    "stam": 1.4,
    "dur": 0.1,
    "ctrl": 1.6,
    "ment": 1.7,
    "sens": 2.0,
    "heal": 0.2,
    "supp": 0.4,
    "intel": 1.6,
    "range": 1.6,
    "aoe": 0.4
  }
}