{
  "id": "2a582280-0d54-5350-aa49-91a32b3a986f",
  "name": "Дуэль",
  "decaySide1": [
    1.0,
    0.0,
    0.0,
    0.0,
    0.0,
    0.0,
    0.0,
    0.0,
    0.0,
    0.0
  ],
  "decaySide2": [
    1.0,
    0.0,
    0.0,
    0.0,
    0.0,
    0.0,
    0.0,
    0.0,
    0.0,
    0.0
  ],
  "enabled": true
}